{
  "analyst_disposition": {
    "analyst_notes": "",
    "review_timestamp": null,
    "saved_locally_only": true,
    "status": "UNREVIEWED"
  },
  "atomic_claims": [
    {
      "claim_type": "fact",
      "confidence": 0.2,
      "counterevidence_ids": [
        "evidence-index-v2:000083125920000004:paragraph-19244",
        "evidence-index-v2:000083125921000009:paragraph-00530",
        "evidence-index-v2:000083125921000009:paragraph-03293",
        "evidence-index-v2:000083125921000009:paragraph-03627",
        "evidence-index-v2:000083125921000009:paragraph-03686"
      ],
      "exact_wording": "The current filing excerpt states: 'A major outbreak of COVID-19 at any of our operating sites",
      "final_disposition": "VISIBLE_UNCERTAINTY",
      "novelty_review": {
        "ambiguity_reason": null,
        "best_matching_prior_evidence_span": {
          "acceptance_timestamp": "2020-02-14T20:59:58.000Z",
          "evidence_id": "evidence-index-v2:000083125920000004:paragraph-19244",
          "filing_date": "2020-02-14",
          "lexical_overlap": 0.041667,
          "matching_financial_roles": [],
          "matching_numeric_terms": [],
          "outside_display_excerpt": true,
          "paragraph_number": 19244,
          "score": 0.140137,
          "section": "item_12",
          "semantic_similarity": 0.404624,
          "source_type": "SEC_10_K",
          "text": "The following table presents information regarding our equity compensation plans as of December 31, 2019."
        },
        "confidence": 0.15,
        "display_excerpt_status": null,
        "earliest_identified_prior_occurrence": null,
        "lexical_overlap": 0.041667,
        "matching_legal_or_accounting_role": [],
        "matching_numeric_terms": [],
        "semantic_similarity": 0.404624,
        "status": "GENUINELY_NEW_TERM",
        "top_prior_matches": [
          {
            "acceptance_timestamp": "2020-02-14T20:59:58.000Z",
            "evidence_id": "evidence-index-v2:000083125920000004:paragraph-19244",
            "filing_date": "2020-02-14",
            "lexical_overlap": 0.041667,
            "matching_financial_roles": [],
            "matching_numeric_terms": [],
            "outside_display_excerpt": true,
            "paragraph_number": 19244,
            "score": 0.140137,
            "section": "item_12",
            "semantic_similarity": 0.404624,
            "source_type": "SEC_10_K",
            "text": "The following table presents information regarding our equity compensation plans as of December 31, 2019."
          },
          {
            "acceptance_timestamp": "2020-02-14T20:59:58.000Z",
            "evidence_id": "evidence-index-v2:000083125920000004:paragraph-05669",
            "filing_date": "2020-02-14",
            "lexical_overlap": 0.103448,
            "matching_financial_roles": [],
            "matching_numeric_terms": [],
            "outside_display_excerpt": true,
            "paragraph_number": 5669,
            "score": 0.133776,
            "section": "item_16",
            "semantic_similarity": 0.290749,
            "source_type": "SEC_10_K",
            "text": "Following are our ownership interests at December 31, 2019, in operating mines through our consolidated subsidiaries, Freeport Minerals Corporation (FMC) and PT-FI:"
          },
          {
            "acceptance_timestamp": "2018-02-20T22:05:25Z",
            "evidence_id": "evidence-index-v2:000083125918000008:paragraph-14775",
            "filing_date": "2018-02-20",
            "lexical_overlap": 0.055556,
            "matching_financial_roles": [],
            "matching_numeric_terms": [],
            "outside_display_excerpt": true,
            "paragraph_number": 14775,
            "score": 0.131977,
            "section": "item_8",
            "semantic_similarity": 0.356589,
            "source_type": "SEC_10_K",
            "text": "NOTE 19. QUARTERLY FINANCIAL INFORMATION (UNAUDITED)"
          },
          {
            "acceptance_timestamp": "2019-02-15T19:25:42Z",
            "evidence_id": "evidence-index-v2:000083125919000009:paragraph-14471",
            "filing_date": "2019-02-15",
            "lexical_overlap": 0.055556,
            "matching_financial_roles": [],
            "matching_numeric_terms": [],
            "outside_display_excerpt": true,
            "paragraph_number": 14471,
            "score": 0.131977,
            "section": "item_8",
            "semantic_similarity": 0.356589,
            "source_type": "SEC_10_K",
            "text": "NOTE 19. QUARTERLY FINANCIAL INFORMATION (UNAUDITED)"
          },
          {
            "acceptance_timestamp": "2020-02-14T20:59:58.000Z",
            "evidence_id": "evidence-index-v2:000083125920000004:paragraph-18710",
            "filing_date": "2020-02-14",
            "lexical_overlap": 0.055556,
            "matching_financial_roles": [],
            "matching_numeric_terms": [],
            "outside_display_excerpt": true,
            "paragraph_number": 18710,
            "score": 0.131977,
            "section": "item_8",
            "semantic_similarity": 0.356589,
            "source_type": "SEC_10_K",
            "text": "NOTE 19. QUARTERLY FINANCIAL INFORMATION (UNAUDITED)"
          },
          {
            "acceptance_timestamp": "2019-02-15T19:25:42Z",
            "evidence_id": "evidence-index-v2:000083125919000009:paragraph-05037",
            "filing_date": "2019-02-15",
            "lexical_overlap": 0.047619,
            "matching_financial_roles": [],
            "matching_numeric_terms": [],
            "outside_display_excerpt": true,
            "paragraph_number": 5037,
            "score": 0.126834,
            "section": "item_6",
            "semantic_similarity": 0.351351,
            "source_type": "SEC_10_K",
            "text": "Refer to “Outlook” for further discussion of projected operating cash flows for 2019."
          },
          {
            "acceptance_timestamp": "2018-02-20T22:05:25Z",
            "evidence_id": "evidence-index-v2:000083125918000008:paragraph-04045",
            "filing_date": "2018-02-20",
            "lexical_overlap": 0.068966,
            "matching_financial_roles": [],
            "matching_numeric_terms": [],
            "outside_display_excerpt": true,
            "paragraph_number": 4045,
            "score": 0.125771,
            "section": "item_6",
            "semantic_similarity": 0.315789,
            "source_type": "SEC_10_K",
            "text": "Includes a gain on redemption of noncontrolling interest of $199 million for the settlement of our preferred stock obligation at our Plains Offshore Operations Inc. (Plains Offshore) subsidiary."
          },
          {
            "acceptance_timestamp": "2020-02-14T20:59:58.000Z",
            "evidence_id": "evidence-index-v2:000083125920000004:paragraph-10334",
            "filing_date": "2020-02-14",
            "lexical_overlap": 0.068966,
            "matching_financial_roles": [],
            "matching_numeric_terms": [],
            "outside_display_excerpt": true,
            "paragraph_number": 10334,
            "score": 0.125771,
            "section": "item_6",
            "semantic_similarity": 0.315789,
            "source_type": "SEC_10_K",
            "text": "Reflects the estimated impact on annual operating costs assuming a 10 percent increase or decrease in the exchange rate reported at December 31, 2019."
          }
        ],
        "what_did_not_change": "No unchanged element established.",
        "what_specifically_changed": "See proposition and matched spans."
      },
      "novelty_status": "GENUINELY_NEW_TERM",
      "prior_occurrence_search": {
        "documents_searched": [
          "000083125918000008",
          "000083125919000009",
          "000083125920000004",
          "000083125920000024",
          "000119312520042621",
          "000119312520061782",
          "1788DFF6CD66373CEFBDC7C4284612FA7E70A16DEEC74853377CA7E80848FB47",
          "773E634F21253DF61CAC38064F341E175EF59C7A0132B287A116E64AA284E7B5"
        ],
        "performed": true,
        "query_terms": [
          "19",
          "any",
          "at",
          "covid",
          "current",
          "excerpt",
          "filing",
          "major",
          "operating",
          "our",
          "outbreak",
          "sites",
          "states"
        ],
        "top_matches": [
          {
            "acceptance_timestamp": "2020-02-14T20:59:58.000Z",
            "evidence_id": "evidence-index-v2:000083125920000004:paragraph-19244",
            "filing_date": "2020-02-14",
            "lexical_overlap": 0.041667,
            "matching_financial_roles": [],
            "matching_numeric_terms": [],
            "outside_display_excerpt": true,
            "paragraph_number": 19244,
            "score": 0.140137,
            "section": "item_12",
            "semantic_similarity": 0.404624,
            "source_type": "SEC_10_K",
            "text": "The following table presents information regarding our equity compensation plans as of December 31, 2019."
          },
          {
            "acceptance_timestamp": "2020-02-14T20:59:58.000Z",
            "evidence_id": "evidence-index-v2:000083125920000004:paragraph-05669",
            "filing_date": "2020-02-14",
            "lexical_overlap": 0.103448,
            "matching_financial_roles": [],
            "matching_numeric_terms": [],
            "outside_display_excerpt": true,
            "paragraph_number": 5669,
            "score": 0.133776,
            "section": "item_16",
            "semantic_similarity": 0.290749,
            "source_type": "SEC_10_K",
            "text": "Following are our ownership interests at December 31, 2019, in operating mines through our consolidated subsidiaries, Freeport Minerals Corporation (FMC) and PT-FI:"
          },
          {
            "acceptance_timestamp": "2018-02-20T22:05:25Z",